3,Galaxy s ll A good app. Not for levelling your cnc machining centre but good for a picture or level a fridge. Simple things. Friendly permissions too. 3 stars.
5,Simple n Easy Excellent app and very useful.
5,Mike Holmes Very nice app. Effective and accurate.
5,Great app. Simple interface, works very well! Thank you!
5,Galaxy s ll Pretty awesome used it to replace the toilet paper holder and towel rack in our guest bathroom! Definite keeper!!
5,Great Simple. Clean. Easy to use. Easy on your phone storage.
5,Good Does what it's supposed to. GS2 on gingerbread
5,Sick works great Best levelers app hands down
3,Samsung gs 3 App only works for a few uses and then data has to be cleared or it just freezes on GS3 dev please update
5,Pretty darn cool This is a pretty cool app, I like the simple features it has, such as the change of view when you tilt your phone. It's pretty spot on too. Good job who ever had it!
5,Bubble level Absoloutly brilliant 5 stars
5,HTC EVO LTE app works great
5,Antony One of those stupid apps that you may never use or need, but if you ever need it...
3,Ok for most things Rubbish at 45 degrees. It just keeps switching between potrait and landscape impossible to read.
5,Handy Handy easy to use.
5,Handy Tool Sure beats going to garage or driving to shop for tools!!! Needs an occasional calibration but usually its the phone! Then, viola...perfect!!!
4,Contractor A useful tool for my portable device.
5,Great Have installed 2 doors, an archway and countless shelves, racks and trim with this app. Works great.
5,Perfect Works simply perfect. Used it to level pix with my phone. Slick, easy, and free. What else can you ask for?
5,Great Works great. Just make sure you don't drop ur phone!
4,Awesome... This is cool...i love this app
4,Spirit Lvov Good 4 work
5,Andrw Useful. Very. Have used this for work.
1,Force close after changing settings Force close after changing settings Nexus S 4.0.4
4,Level Decent level for when you forget or misplace yours.
5,No problems Quite simple. I've had no problems using it.
5,Great app..... shame my phones edges are rounded :( would be perfect on an ... Great app..... shame my phones edges are rounded :( would be perfect on an iphone!
5,RogerH Very handy, practical app.
1,Good, battery killer Works awesome but new update doesnt allow phone to sleep and kills my battery in about 11 hours if its not being used. Had to delete it, handy when needed
5,B.B. I use it all the time, very accurate and works great!!!
5,Sweet Great app!
5,Bubble Level I LOVE IT!!!
4,Excellent app Brilliant app. I used it when tiling my bathroom
5,Simple, effective & lightweight Perfect as it is.
5,Great app. Handy and useful. Thanks.
5,Awesome!! Great app, free, works, in SD, and does not chug memory. Thx developer.
5,Nice, Galaxy SII Epic Touch I used this once recently to hang a fixture after having it installed for months. This qualifies as one of the more useful apps now. Love the way bubble level changes type when orientation changes.
4,HTC Incredible Works great for hanging things like pictures and the like. Handy app to have.
5,Good Does exactly as needed
5,Handy tool Fills the bill in a pinch
5,I love this app. Excellent job. Thank you developer.
5,Perfect Does exactly what it says and easy to use.
5,Perfect! Nice and easy. You get what you expect. Thx :-)
5,Does what I need it to do @ Keith, I'm not an expert but I would recommend to use a real level to calibrate it. Just saying, thats how I did. Lol
5,Nifty little thing Used it to level a crooked desk. Worked =D
5,Awesome app Great app works perfectly.
4,Nice one Good app to find level and to calibrate phone.
5,Neat Does what it s supposed to, and is mighty useful!
4,bla89 very usefull app.,!!
5,Works great Like the title says, works great.
5,Free, no ads, works. No funny permissions, no ads. Thank you, dev!
5,Very useful I am impressed how accurate is this tool. 5 out of 5
5,Works as advertised Simple and clean, easy to set up.
5,Great App Works well
4,Works great Operating smoothly very responsive. Very accurate, not 100% but close.
5,Samsung Galaxy Works great.
5,Simple and easy to use!
5,Galaxy tab Nice app well done
1,Dont loose your time
5,Works great A very useful till
5,Excellent Works for me
4,Mr. Naked Pretty close good app
5,Sid Simple but very usefull.
5,Best level app
5,Perfect: easy, complete, lightweight and free (GPLv3).
5,Great tool!!! I have used this level in several applications when all I had handy was my phone. From setting up cooking stations in the woods to leveling my trailer for camping. Awesome!!!!
5,Great Works as advertised
4,level good app, works fine
5,Works awesome on comando Darth Vedder used it too level a scope for my X-bow. Quick n easy for pictures too!
5,Cool I like the automatic orientation change.
5,Wow Great app really works
5,Great App
5,Monk Excellent tool and works great...
5,Great level
1,Inaccurate Not accurate at all
5,Accurate
5,Love it!
5,Grea Good
5,Very useful
5,Good
4,Good Ya
4,Mr. Good Good. Stuff
5,Good tool
5,Madd So goood
5,Handy
4,Good. Good.
5,Spot on This leveler is spot on once its calibrated.
5,Awesome Love it
1,couldn't configure
5,No ads! No ads and very accurate.
5,. It is coool
4,Haha.... Terbaik!!!!
5,Useful Great tool to have
5,Excellent Works great!
5,Cool
5,Useful Excellent.
5,Awesome ..
5,Goood Practical
5,Works as advertised. Stable.
5,Good Good
5,Bubble level Can't beat it
5,Works very well!
4,Bubble level Works for me. Dan
5,Bubble level Cool
5,Handy
5,Does the job. I was just hanging pictures. If I was building a house I'd probably go to Home Depot.
5,It works I thought it was just a novelty but it actually works & is true on the level.
4,Like a lot
1,Horrible! Made me install a mirror crooked
5,Works well I like it
5,TRUBLU LEVEL ÅãTRUTOO
5,Does what it does.
5,???? ????????! ????????? ??????? ??????? ??????? ?????????? ??????. ????? ?????!
5,I use it all the time
5,Works Works
5,bubble rate
5,Works Works well
5,Level Ok
5,razr works
5,DROID x
5,Works I'm well happy with this. I especially like the way it beeps on level! If it helps anyone, I switched to 'orientation sensor' - Galaxy Ace, UK.
2,Could not calibrate properly Looks like it would be handy if it would calibrate correctly. When standing up it registered level when the phone was crooked and when I put it level, it registered all the way to either side. Using the sideways level worked better but still not true.
5,Good level tool This is the most addicting game ever
5,Haha
5,Bubble level cool tool especially for a tool freak like me!
4,Cool Not sure how accurate it is but it works - and no weird permissions.
5,Lifesaver if you need to reset your phone's compass or accelerometer this does it too. Perfect design.
1,Off Off
5,It works great ,requires nearly no permissions and is totally free, how can I ... It works great ,requires nearly no permissions and is totally free, how can I not give it 5*
5,Great Works as intended. 5 stars for Action bar implementation and keeping the UI updated to ICS.
5,Works
5,Faultless, if only all apps were this good! Simple, reliable, accurate, does what ... Faultless, if only all apps were this good! Simple, reliable, accurate, does what it says on the tin .
5,Works perfect. Hung my 51" Plasma with this apparently. TV is perfectly level so apparently is the real deal. And all the people who can't get an accurate level....recalibrate on level surface before use.
2,This app doesn't work here. The Bubble Level app works just fine, but with ... This app doesn't work here. The Bubble Level app works just fine, but with this one the bubbles seem very nervous, popping from the left to the right.
5,Works well Use at work. Compared to torpedo level I use for conduit as well as machinist level. As good as torpedo, just a little off on machinist. I believe I can comp with calibration, but plenty good for hanging light fixtires.
5,AWESOME!!! YOU CAN ALWAYS TELL IF A GUY'S ON THE LEVEL IF HIS BUBBLE'S IN THE MIDDLE. :)
5,Love the options Tried a couple different Level apps and found this very helpful? Leveled my Fridge! Also, Calibrating will compensate for any protruding buttons on your phone. just gotta remember to use the same side of phone every time.
5,ok App I played around with it works fine for my needs. I would not use it for any thing mission critical work. for setting picture frames and or house hold tables or things like that it is a good tool to have on your phone
5,Good idea Very good virtual tool. Next app should make phone a chainsaw
1,Update ruined a great app All the other apps were 90 degrees off on my tablet... this was the best. That is until... until the update,.. worthless now.... have no working level app now thanks to the update..... what a disapointment. Funny... 1.9.0 & 1.9.1 says now support tablet.... 1.9.2 should say....now it does NOT support tablets!!!!!!!
5,Xperia Arc S Cool. Seems to work fine.
3,Sony Ericsson Live Very useful if didnt need calibrating
1,... This level is out of level,
4,Too bad Seems to be very accurate, but not with the Nexus S, the phone has no solid straight edge.
5,Bubble level Very cool! Appears the phone must be horizontal to work properly.
5,Very Nice Works well on my rooted book tablet.
5,Works! Love it. Precise. Works just like it is advertised and supposed to work. Practical for all your leveling needs. Its not a power hog, gimmick or crap app! Works seamless with no BS.
1,Axis reversed in this version. App is no longer usable due to axis beng swapped in this version. Please upload older version under alternate name.
5,Yay! I've been doing a lot of projects lately and this is so handy. I use it constantly and its accurate :) HTC Evo
5,Bubble level Works great used it several times.
5,Simple but effective. Does what it says.
5,Testig accelerometer I used this app to test the accelerometer on my phone (which I found does noy work), but I can definitly see this being used for it's intended purposes. Nice. Where is the source code for this?
5,Muy recomendable Una de las mejores aplicaciones pr?cticas referentes al uso de los sensores. Simple y eficiente. No reclama acceso sin condiciones a tu equipo. Se agradece mucho.
4,Handy Really handy when u need a level & don't have the tool with u.
5,Great app Great app still great after update on my Huawei Ascend 2
4,Nice and simple Only used it about twice in the last year, but when I've needed it it's been great to have. Seems to be accurate.
5,Very handy Nice interface and not bogged down with ads. kudos to developer.
5,I love this app its actualy correct. I use it all the time at work
3,New update has major flaw! Bubble goes in wrong direction after update. App is no use now! Was excellent before.
5,Bubble goes wrong way after update. Bubble goes wrong way after update.
5,This ap comes in handy.
5,Briumph Simple and works perfect! Thanks
5,Great ap! Nice ap! Easy to use!
4,Not to shabby Works good handy for the house our on the go
5,Very cool Works like my level and cooler
1,Pointless by design The bubbles work +-45 degrees, needs to work more like the real thing
5,Useful! with Great FUN!
5,Best level I've seen! Works great with my Rezound.
4,Quick install. Like the choice of levels.
5,Simple Small, efficient.
5,Fast install. Works great
5,Super App!! Works great.
5,Bubble level I just love it
5,Gd app Very handy
5,Works great Perfect, great free app. No unnecessary permissions.
4,Bubble level Great :
1,SUCKS Horrible!! Does not work!!! Way off!!! DO NOT USE!!!
5,Worked great
1,Not accurate Not even close...even after calibrating
5,Awesome app Love the fact that it gives you a precise % measurement in addition to the normal bubble, all with no ads and no special permissions.
5,Bigred Works great
5,Awesome!! Love it.
5,David Love this app
5,Works great simple
5,Useful That is all
5,Great Tool Saves on carrying a long, bulky piece of equipment
4,Great
5,Great one This was one of my first apps, it has been one of the most useful apps ever!
5,Very handy!
5,Good Convenient
4,Nice to have on hand Very convenient & easy to use
5,Pretty good Does what it is suppose to
5,Good App No adds. Awesome.
4,Level handi Nice
5,Focus Awesome
5,Its great I love it
5,Will It gets the job done...
2,Ok before update Does not work well after update. Samsung ace.
5,Well-executed It's a simple idea, but real software development is not the cakewalk some people seem to think it is. This is a well-written app -- it's tiny, stable, and does one thing well. Bravo!
1,Poor No good
5,Level Thanks!
5,* Great & useful app.
1,Junk Junk
4,Samsung Fascinate (Galaxy S) Works well. Have used out many times- mostly, when hanging pics.
1,Doesnt work Its unresponsive and inaccurate
5,The show Brega al 100%
5,Wotsitdo Brill app does what it says
4,Super handy !
5,5 5
4,Level
5,Nice app Easy to use, never crashes
4,Excellent Very handy
5,Yes, this works very well
5,Very nice Very nice App
4,Bubble Works ok
5,LOL Dope!
2,Works incorrectly on tablets? Level orientation is always off by 90Åã on my Acer Iconia. Looks like this app doesn't work correctly on tablets.
4,Good app Works well in a pinch when no level is around. I use it to level picture frames and such. Worth the download.
5,Love this app I use this app frequently at my job. Never lets me down.
1,Does not work Would not read true level even after calibration on samsung galaxy s2
5,Works great! It works, it's free, it's ad-free. What more could you ask for?
5,Calibrate and good to go. It would probably be a good idea to calibrate it first. Your phone probably wasn't calibrated right at level / plum . So it's not the apps fault if is a bit off. Also watch for things like bumps from buttons, cameras, and curves in phone
1,Way off ...! I'm a journeyman carpenter with over 22yrs and downloaded this app to level a picture frame on my wall. It was off by almost 1/2"!!!! this is simply a novelty, NOT to be trusted to ACTUALLY plumb or level anything. MVM - Phx Az
5,FANTASTIC App! Very useful. I use it more than I thought. Extremely handy to have. Very accurate once calibrated.
5,Awesome. I was positive that the pinball machine tilted right, and this proved it. Useful, free, fast, without unnecessary app permissions. Thanks, and best of luck.with your other efforts!
3,Word Word
5,BLACKGUNGURU As long as u have a good spot to calibrate, this app iz hands down best level app in existence:)
5,Very good Not perfect but close enough for basic stuff.
5,Chris Great app. Works on Xoom, just need to go into settings and alter orientation.
3,Alright It seems to work ok.... it drains the battery a bit too quick. Atrix2
4,Great app! I have used this app more than I ever thought. When I need a level it's as close as my phone.
5,A first-rate software product. Why can't other Market apps be this perfect? Calibration feature is spot-on.
2,Poor calibration/accuracy Does not allow for true 180' calibration. (Rotate device 180 on " level" surface. If TRUELY level surface, level will remain at zero.)
0,Good however I did notice that is does not handle 45degree angles well
4,Really handy This is a no frills, no extras app. Does what it says, does it very well.
5,Derik VERY handy and accurate for field geol. Nice & simple to use and calibrate. Perhaps the addition of a compass on same circle w/round bubble level? A+!
5,Bubble level Use it to level my touring caravan so easy no more hunting for level I had used before downloading this app
5,Best for galaxy nexus Tried lots of level apps on galaxy nexus and some jitter and some don't rotate, this one is smooth accurate and it works with rotation perfectly. I like the clean looks here too...
3,Good idea But not every phone is totally flat. Buttons and camera stick out to create a uneven surface
5,Works great. Works very well, what else its there to say?
5,Nice Works good. And stop complaining and calibrate it.
5,The right tool for me & you. Quick. Easy. Simple. I use it all the time.
5,Great app Brilliant app 5 star all the way
5,Worth Money This app does it's job brilliantly, with an intuitive interface and decent graphics.
5,Great Very useful. Very simple
4,Quick check Great for doing a quick check. Sure it is not going to be very accurate but hanging a photo or seeing a general angle it works great.
1,Doesnt work on xoom Orientation off by 90degrees on xoom tablet
5,Excellent and accurate Great app to have. Very handy for getting things justright.
2,LG G2 hates this level Could be the phone, but I would calibrate on a known level surface & then move to a different surface and calibration would be off. Tried 5 or 6 times with no success. It also seemed to never get which way it should be oriented except when it was on its back.
5,Nerd toy Appears to have been a fun app to write. It is a level. Not much else to say.
5,Bubble app I use this app several times a week. At first I was laughed at but now I am asked to pull it out and use it.
4,Helpful Worked absolutely great in a pinch. Didn't have a level to hang a shelf. But Idk if I would trust it over a real level....
4,Handy Good to have, if only to keep the wife quiet about whether or not the stove is level.
5,Great little tool I can't tell you how many times I've used the handy tool .... it always impresses people too.
1,Doesn't work on Galaxy S II Doesn't work on Galaxy S II
5,Great app Do figure "eights" with your phone if it doesn't seem to be working and it will work perfectly - it's the phone that needs adjusting.
1,A malfunctioning app The tilt it shows is 90 degrees off. Tilt it to the left or right, and it will show a fore/aft tilt, and vice versa. How useless. ( This is on a samsung galaxy.)
5,level Very nice app. I downloaded it at work and used this the same night at home to hang curtains. Wife loves it!
4,A level view. A well thought out, easy to use app. It does what it's asked to do. The only downside is the site view is a little small, hence the 4 instead of 5.
5,Great I just used it to hang my televisions in my offices. This isa vere useful app highly recommend it .. Galaxy S ll
5,Galaxy SII Works flawlessly! Kudos to the developer!
5,Excellent! Works great. Simple, small size. And ad free!
5,Great! I love the calibration ability. I forgot my bubble level when doing some plumbing. This app saved the day. Thanks a lot!
5,Keep the good work! Awesomeness. ;)
5,Works great & seems accurate, no problems with this app that I've seen!
5,Great Awesome...accurate....must have
5,Genius! I love this app. So simple, so useful. Great on HTC Inspire 4G.
5,Sweet Cool app to have. I brought this to my first construction job. My boss punched me in the face! Good times!
5,Nice! Have used this in a pinch a couple of times and it's done it's job.
5,Solid Does what it needs too do, nothing that it doesn't. No needless permissions either. Great app.
5,Wow! Works. Perfectly. Free. Thank you! Xperia arc
5,Good app Seems to be accurate.helped me set a satellite dish up.
5,Good app If u smart you would set updates to manual update so you can get a idea how good the update works ya knob
4,Works great Does what it claims to do.
5,Useful when I used it to ensure the toilet accessories are leveled during ... Useful when I used it to ensure the toilet accessories are leveled during renovations.
5,Nice tool! Simple and works great!
5,Used in a professional environment did not trust to start with but now used ... Used in a professional environment did not trust to start with but now used instead of a traditional level highly rated
5,Works great on my HTC Sensation!
5,: ) So far no problems with the app at this time. Working good for me. Comes in handy at times.
5,Nice Saved me $ and a trip to hardware store
5,Excellent! I really like it!
5,Very Handy Extremely helpful. Saved my bacon when I was trying to hang a shelf. A++
5,DH Good, apps!! Thx.
5,Works Works perfect. Just what I needed.
4,do what it has to do simple and goes to measure. a simpls tool everyone should have it.
3,Good Would like to see bigger text display and a rise over run
5,Surveyor Really really cool. I use this on multimillion dollar projects.
5,Great tool to get you out of a jam Great tool when you forget your tools.
3,Great Works on my galaxy s2!!!
3,Will not install I think this app is a brilliant idea and I've had it for a while but it won't install the new update. HTC Wildfire.
5,Fantastic - recommended - easy to use and has settings for roof pitch, angle ... Fantastic - recommended - easy to use and has settings for roof pitch, angle or percentage display and two types of level display
1,Worked before, now useless Had this app on my original droid. Worked well. Fails miserably on droid x2. multiple calibrations, still won't level. Uninstalled.
1,Doesn't work correctly Moto XOOM, incorrect orientation. It is 90 deg off. Can't find a way to correct in prefs. Makes it of limited value.
1,Crazy orientation after update Orientation is crazy after the update. Uninstalled.
5,Gs2- Very good app
5,Droid RAZR Works great.
5,Oscar It locks real and accurate awesome !!!!!
5,Alarms Works great leveling keypads
5,Use it when you need it Works great when you need level something real quick.
5,Nice, easy and simple App. Works well.
5,Love it Use it all the time!
5,Highly recommend if you have mild (or chronic) OCD :)
5,Simple, but an excellent tool
5,Bubble level Very handy app.
5,Awesome app Man, it comes in handy when you least expect it. DROID 3
5,Great Now even better.
5,Question... I have a DROID X2. The top end of the phone where the camera is located is almost twice the thickness of the other end of the phone, so when it is laid flat, the phone is not itself level. Does your app account for this?
3,Sideways On my Samsung galaxy excite, it's sideways. Not as useful as it was on my nexus1
2,DROID X Isn't accurate at all. I Even calibrated it and did not help.
1,about as good as my eyeball level. Galaxy s Vibrant
4,Seems to do exactly what it says it will. Works great. Droid Incredible.
3,Good for stuff occasionally. Good for hanging pictures, leveling tv, etc.
5,Neat! Handy gadget. :)
2,Constatly disappears on droid bionic I love the app, however, it disappears off of the bionic & I have to reinstall it over and over again.. this is the only app that does that.
1,Totally not level. I tried to use it for a picture and it was like a 45 degree angle when it said it was level.
5,Won't do bar level at all. Epic 4G andr 2.2 Won't chg from 360* version, so nothing to lock. Difficulty (for me) measuring inclination.
5,Excellent Use it on my Bionic. Very handy.
5,Love it Great app, I use it all of the time!!
5,Nice appear. Thanks y'all!
5,Great! Works as expected, great app & open source!
5,Very good, simple level!
5,Awesome Works great on my Samsung Galaxy S II
5,Great app, hangs now & again
5,Excellent I downloaded and used it within one minute. Perfect result.
5,Great Excellent works perfect my house has never been more level
5,Excellet It works great im happy.
5,Britt Very useful.
5,Seems To Work Tried it out when putting up a white board the other day. Seems to have gotten it straight.
2,No cigar Just not good enough
5,Level tool is great Very helpful!
3,Bubble Would like more sensitive bubble
5,Works great thanks.
5,Perfect Useful and nice looking too.
5,Great, as expected.
5,Great App Love it for quick jobs
5,Dave Much needed tool
5,Really good App :) Really good App.
5,Very good Good app does what it says
5,THE Butcher Very nice & accurate.
5,It works great keep up the good work!!!!
4,? Quick and easy.
5,This app is on the level! This app is simple and amazing.
1,Bubble level Rubbish used on picture frame and was clearly not level
5,Works Great Needed a leveler quick works great!
0,Sucks cant update........
5,Bubble Th e only thing weird is the bubble falls instead of folats up hill
5,Amazing So useful
5,. Awesome app
5,Really good app Steve
5,What's not to like? Does one thing and does it well.
5,Rocco Nice app
1,Get with the program Facebook....
5,Easy to use And awesome
1,Level is not level completely crooked
5,Simple and great Since my phone has rounded edges, being able to lay the phone flat is useful.
1,Horrible Pos.. Wayyyyy off.
5,Always works excellently
5,Shawnjohn Works great when rushed. I like it.
5,Level Awesome for contractors
5,Av Works great
5,Nice Nice level very accurate
5,Neat Great tool.
5,Love it. Works great
5,Nice level Works great
4,App Great app
4,Great Apps!
5,Awesome!
4,Great Niceee
5,like works quite well
5,Great Works great
5,E4GT Great.
5,Usefully Awesome app
4,Useful gadget
5,Works great.
0,Love it! Works great!
5,Handy ...and easy. Thanks
1,Sucks.. Numbers keep toggleing back and forth
5,Great app Love it
5,Works great, love it Such a helpful app when I just need to quickly check if something is level. I have a case over my phone so the edges are even so I get an accurate reading.
5,Level Love
5,Great app
5,Works perfectly
4,Cool Use to level our RV
4,Great Pretty close to a real one
5,Great!
5,Wow fillipin gr8
5,Great n simple
5,Good App
5,Great Love it
1,Inacurate
5,Very Very Very Goooood
5,Fantastic
5,Cool No comment needed
2,Looks too plain
2,. Kinda lame
5,Got me outta trouble at work!
4,Program praktik per nivelizime. Ron Reci Gostivar,MK
5,Love it!
1,crashed on galaxy s
1,Garbage Orientation constantly switches even when I hold the phone steady
5,Great Great
5,Handy Great tool
5,Love this Awesome
5,Excellent tool Superb
4,Fun and useful.
5,Great Great app
5,Cool Cool!
5,Does what it says it will do. No ads so full marks
5,atrix 4g mantabb.....
5,Does what it should
1,Bad Bad
4,Jbinsetx Works
