5,Great handy tool Easy to use. Great to have this handy gadget around. May not be 100% perfect but good enough for me.
4,Horz works great! The horizontal level works great...! Very accurate when comparing with other physical levels. But as others say, vertical level is way off, and impossible to calibrate on Nexus 4.
5,Dead on at install Samsung Galaxy Tab 3 - Android 4.3 I knew as soon as I turned this app on that it was accurate as decades of engineering and design have heightened my sense of "horizontal". Great app that will be super handy in the field, esp with the readout showing 1/10 of a degree accuracy. I don't mean to flame the "Calibration whiners", but come on. If you live in even a semi-new home just lay the thing on the bathroom counter to calibrate it (as one person already pointed out, most professional installed surfaces are already level.) If you just want to hang pictures here is a tip.. calibrate it by using the wall... if the wall is crooked and your pictures straight then it will show. :] Meanwhile, you should only have to calibrate it once. I also suspect that people who yell that it is way off just have bad sensors because the app is solid!
5,Johnny on the spot! A friend first showed me this app on his iPhone. I now have it installed on my Samsung Note Android device. It's simple, it's easy, its free, and it works flawlessly. I freaking love it!
4,Needs calibrate first This thing surprisingly accurate. Only con is it needs a reminder to calibrate upon first use.
5,Great app It works great on my mini droid, so simple but very good at what it does. Easy to calibrate and set up.
4,Very good Do what it is supposed to do in a wonderful and simple way, I love it :-).
1,Woow... My teacher once said, "A calculator is only as smart as the man using it". Meaning if you don't know to use it then it becomes useless to you. I downloaded this app while holding up a heavy corkboard in hopes of nailing it the wall. Needless to say I was unable to calibrate it so it became useless to me. A lil frustrating holding up something large & heavy! Leason learned & would not recomend this app!!
3,Does not work for vertical surfaces On nexus 4, when measuring vertical surfaces (portrait mode), incorrectly uses both accelerometers, which makes it impossible to level, even after calibration. It should only use one of the accelerometers in this mode, or use a better calculation. On the other hand, works perfectly for horizontal surfaces (landscape and surface modes).
4,Works great you'll love it Very accurate,love it,use it all the time.
2,Hmmm... Trying to use the standard bubble level with the volume control on one side of my phone wasn't easy, and the two readings when laying the phone flat (circle) were rather complicated too. Uninstalled it.
5,Excellent Not quite a master machinist level :-) but more sensitive than a torpedo level. And yes, the price is right, too.
5,A handy app which works well Have used this on several devices. Not perfect - not quite as accurate on some surfaces as an actual spirit level but the fact that it is always with me makes up for limitations.
5,Works Very Well Works very well and ensures that I always have a level on hand when setting up my caravan, I love the "Ding" when you get everything level. Recommended and with no excessive permissions it is a must have app. HTC One XL with Android 4.0.4
5,Simple measurement tool Uses the gyroscope to measure level. Does no less than a real bubble measure, assuming your phone's sensors work!
1,App require perfectly level surface for calibration If I need this app I probably don't have a real level which means I won't be able to know if a surface is truly level. Rendering this app totally useless. Also the default calibration is completely off. You can tell just by looking at it!
5,Nice Just a level checker. No less, no more. And works really accurate.
5,I like comprehensive yet simple application, commercial-free like me want to donate lol
5,Great simple app Great for when I had to throw some shelves up last minute and forgot where I stored my level. Quick download and works great! Thanks!
5,Simple application that does one thing well No questionable permissions required = 5 stars. I only use it for leveling horizontal surfaces. Vertical mode seems to be broken on Nexus 4.
5,very nice very helpful ,simple ,doesn't consume a large space in the memory great job. 5 stars.
5,Helped a friend move a pool table, didn't bring a level for leveling the ... Helped a friend move a pool table, didn't bring a level for leveling the table. With this app and a few newspapers we were playing a game in no time. This app is wonderful. I do carpentry, and for me, didn't have any issues. LG Optimus 38c. Anyone who says it isn't accurate is what the french call ignorant.
5,Simply the best... and accurate. Forgot to bring a level on a TV install job and was lucky to find this! Works great and very simple.
5,Simple and honest Any app that doesn't require full internet access always 5 stars from me, and it works well.
5,Works well Simple and effective. Can't ask for much more.
5,Epic Small, easy, well made, no ads, no evil permissions. This is very good stuff.
3,Might need tweaking... Does what it says on the tin, but it doesn't seem particularly responsive. I was trying to level a bookcase, and it never seemed to want to move from its initial reading. But I got close enough, so I can't fault the app too much!
3,LG P880 poor accuracy Works fairly well on the back of the phone but useless on vertical surfaces. Never settles even on solid level stone worktop so calibration suspect.
3,To twitchy The bubble moves even when the phone is stationary. Not very useful. Off to buy a 2 dollar torpedo level.
4,Wow...Great App! I compared it to the "real" level. MATCH! Living in a camper...I use my phone for everything! To save space!
5,I Great Tool This is the only one that worked on my pmid705. I have tried 3 others that did not work at all despite the highest in class ratings. I Kudos!
5,Great ! This saved my day when puting up a washingmachine. Most of my day went looking for analog level. When I found this. Flash of genious! Thanks!
5,Works This helped me put up a poster in my room. Looks perfect :)
5,Great! Used it to adjust my washing machine's feet. Now it doesn't shake anymore! Thank you :)
1,Obviously off First time using it to hang a set of coathooks and the app was obviously off. Better job using my eye. Lovely interface, but what's the point if I have to calibrate just to use it?
5,Simple, does what it says. No frills, just a level tool!
5,I like it I wish my phone was flat so would work better.
5,Works good This app is fun to mess with I have opened it up and had people rolling laughing. But they are amazed it works for light jobs lol.
5,Just what I need Nothing more or less. No nonsense permissions surrendered. Oh little hint to those who don't know how to calibrate. Most professionally installed surfaces have already been leveled. Wink wink
5,Awesome!! This app fix my accelerometer!!(needs reboot after calibrate)
5,Works well I've been using it I all devices for years and love it
5,Pure gold What it says works as accurate as your phone can be. Tested with real levels and has always worked. I use to level thermostats. One less tool I have to have in my bag. :)
5,Cool and simple Simplicity rules. Has two different style bubble levels.
3,Does not work in portrait mode On Droid RAZR Maxx the bubble never stabilizes in portrait mode. Works well in landscape mode and when placed flat.
5,Very good Works great! Now if only I could find an app to dig the post-holes for me...
5,Love it Almost as good as the real thing. Actually it's better.
5,Pretty Handy It's very useful. Thanks!
5,Serves it's purpose well This app does what it's supposed to without a cluttered interface, ads, or suspicious permissions. Highly recommended.
5,Level Not got many tools at home, so really helpful.
5,Galaxy Note 3 Nice app! I use this to help level my pictures when i hang them!
5,Accurate, works well Does exactly what it needs to and looks good. No crashes or bugs.
5,Love it! Simple interface. Did exactly what it says. Didn't need to calibrate for simple picture hanging.
4,Good Tool Works well, however, with one minor flaw. When used in portrait rotation, the angle readout seems to be double what the actual value is. Planar and landscape modes seem to report correctly.
5,Useful Thank you, has helped with many projects!
5,It is great! As an Aeronautical Engineer, it is essential to calculate how an surface is with respect to another.
5,Works like a charm! Every time! =) Perfect!
1,Crap It's a piece of junk! Way way off! Nice try and all but I'll stay old school forever now!
3,It just works Much better than using your eye.
5,Great A must to have
1,Terrible Tried to use this to level a shelf I was putting in a closet, and it's nowhere close to being accurate. Now I have to redo the whole thing.
5,perfect. No more and no less than what I needed. No ads, no retarded permissions. Now this is a well made app.
5,Got exactly what I expected Very happy with this app.
5,Great !!! A super little app. Accurate as well !!!!
5,Perfect little app Does what it claims to do with zero effort.
5,I seldom do a job that needs anything more precise than this. Does make ... I seldom do a job that needs anything more precise than this. Does make me wonder how level the edge of my phone is... Great app!
4,Works really well! I haven't used all the features yet, but I hung a few picture frames using the horizontal level yesterday and was very satisfied.
5,Perfect Does what I need and doesn't require any rediculous access. Thank you.
5,Coolest App On Google Play Positives - Everything Negatives - Nothing I would give this app 500 stars if I could. Coolest app I've ever used.
5,Perfect Thanks for not needing any special permissions!
5,Works well for determining roof pitch and matched my 48" level for accuracy too!
2,Contradicts actual level I tried using it to level my camper but the 360Åã bubble moved like molasses even when adjusted in settings. It never agreed with an actual bubble level which I'd set on the face of my note 2. Sorry!
5,Easy and accurate Calibration was great upon install on Samsung Note 3. Simple to use.
3,Basically good I'm not positive when upright the bubble is inverted.
5,Works perfect No ads just does its job well. This is a good developer. 1 of my favourite he always gets back to u if u have any question.
5,Totally awesome I love how it automatically changes the level type based on orientation.
5,Perfect Does what it is supposed to do. Good job dev!
4,Love it! Use it to level out our camper.
5,Great work Its really handy I love it
5,Use it lots I use this all the time when levelling the caravan. Handy
5,Cool App! Very useful in leveling my newly bought abstract paintings!
5,Simple, good Not the level you want to depend on, but if your torpedo isn't in your bags, it'll do in a pinch.
5,Awesome app! Great and handy tool to have!
5,Simple and effective I mostly use it to hang pictures and so on, but it's a handy tool I always have with me.
5,Good Good work! No bulls... once you calibrate it from a real level you can rely on this app with confidence.
3,Nice app Works well make sure u calibrate it
5,VERY GOOD Actually I appreciate the professionality of the programmer No strange permissions are required by this program and it does the job
5,Indispensable. Must have and simple to use.
5,Excellent. Works. No bloat Thank you for developing this great app!
5,Very cool & handy for quick checks. Thanks
5,Good App Simple and works very well on my Galaxy S3 i9300.
4,Pretty good app. Looks nice. Does its job. Sometimes you have to wiggle the phone to get it to catch up with small changes.
5,Good. Multiple levels and ways to use them
4,Good but Doesn't work in landscape mode
5,Handy and very useful Now all my pictures are level and it is much easier to level the RV, as well.
5,Just what I was looking for Does what it says on the box. Great tool.
5,Very good Simple and accurate
5,Great little app for DIY Worked as required. Very handy for hanging pictures and mounting tv's
5,Great tool Simple to use and works great!
1,boo sucks didn't work at all I got fired from work. BC I used this level and didn't.work
5,Clear and simple Does exactly what it should and is clear to read
5,Just what I needed ... And doesn't crash like another spirit level app I tried!
5,Perfect Well, I checked it with my real life level" and the accuracy is perfect.
5,Perfect Does just what It's supposed to :)
5,Cool App Works fine
5,Simple but great app This app is really simple but it does exactly what it says. It also has a really good design and responds very quickly.
5,No special permissions now thats my kind of app thank you. Need this for a project my physical level is at the shop! Thanks for a quality app.
1,If I could give it a zero I would Even after calibration, it still didn't level adequately
5,Great Does what it says on the tin. Works well - no problems.
3,Not Accurate Not bad but not accurate
5,Great app! Works well, and doesn't require any intrusive permissions. 5 stars!
5,Great Awesome very accurate works better without phone case
5,Simple and Effective! It works great!
5,Very nice It helped me a lot!
5,Superb! But eco-mode messes measuring in landscape!
1,Garbage Just garbage. Literally hung something more level with out it.
5,Great Free? No ads? No special permissions? Open source? What's not to like? :-)
5,:) I use it at work often and its on point good job guys.
5,Perfect Simple, no extra BS, does exactly what it's supposed to do.
5,Nice Good workdone It's Beautyful
5,Great! Handy application, works great!
5,Works great Very handy, does what was intended very well. Thank you
1,Not a tablet app Uninstalling just because it opened in phone view
5,Shop foreman Great app, very accurate. ...
1,Never used How about an s3 curved level? No
5,Nice Perfect for hanging pictures.....there's no need to carry a level when your phone is always on your belt. Great for small household jobs.
5,Perfect. Simple and ad-free. Does not require any uneccesary permissions.
5,Works great. Simple interface. Does exactly what it is supposed to do.
5,Functional Does what it is supposed to. Lone the multi-directional capability.
4,I give it a4 star Good
5,Great It's refreshing to see "no special permissions required". And the app works pretty well too. If you need 0.1Åã tolerance then buy a proper tool.
5,Simple and useful Not much more to say.
2,broken, immobile bubble On my phone, bubble stays fixed when the phone is on one side. Pretty non-functional...
4,Pretty cool, can be handy in a pinch.
5,webster good and light, tnx
5,Awesome! Thanks for saving me in a pinch! Love the multiple levels.
5,Very accurate Best level app
5,Very cool It works. DL 7 of them only one that works
1,Don't install Not level at all
5,Used to mount white board Used this tool to mount a white board with multiple helpers. Finally got the level app and finished the task without interruption. Thanks.
5,Perfect Small and useful app
5,Love this! Seems to be Accurate
5,Great app, thanks.
5,Canvas 2 Software is very nice
4,Excellent. Much better than finding a regular level.
5,A great tool with intuitive interface The kind of things that makes you think "ah I love my phone!"
5,Nice app! Has came in handy a few times
1,Bullshit!! My shelves look COMPLETELY FUCKED.
3,Not the best Would like to be able to calibrate seperatly
5,Save your day Great free app Thanks
5,Amazing App The app is amazing; when calibrated correctly it is quite precise. I saved about $10 or so by not going to a hardware store and buying a level!
3,Good Good to have even though I never use it :/
5,AWESOME Thank you!
5,Perfect app Needed a level quick, this app worked great!
5,Works great Works great on my nexus 7 tablet.
4,Nice tool. Effective.
5,Great It worked!
1,inaccurate Even after calibrating 3 times, it was horribly inaccurate
5,Nice and just does the job
5,Great and simple. No permissions
5,Excellent application No cons all pros :D
5,Great app Used it to hang shelves and it was great
5,Good It's ok
5,Fantastic The best yet, and better coz its free lol thanks
5,Really very useful..!!!! Good App
5,Excellent In my s3
3,A bit boring for an adult but very interesting!!!
4,Pretty good. I use this all the time.
5,One word.. Perfect
3,Meh Still not as accurate as the real thing
5,Perfect No ads. Free. Auto orientation. Perfect.
5,Very good. Quick and easy to use.
5,Good level Yea
4,Handy Works well
4,Best free level I found
5,Its very easy
5,Spirit Elevel Excellent
5,Great little tool
5,Very good like it
5,Good Does what it is supposed
5,Easy Great app!
5,Very useful app
4,Freezes all the time and runs slow.
5,Great! Very handy ap.
5,Gs4 Simple and perfect, thanks!
2,Auto start Unnecessary auto start apps.
5,AWESOME Just used it in the basement to level our dehumidifier - took a second to download, NO permissions, and I didn't have to run around to grab another level. This is why I love my phone... And awesome app makers! You guys rock!
5,Works Great!
5,5++++ Simple and the best!
1,Failed Not too exactly
5,waao v. nice
5,Cool app Levelling life
5,Excellent Very good tool
5,Simple...Perfect. Turn it on and it quickly, if not instantly, shows a level that is oriented to the position of the phone. No splash screen...no nothing. Its a level, perfect. Easily worth 5 stars.
3,Works But how do you now the place you use to calibrate it is level?
5,Works and no funky permissions Need I say more?
5,Excellent tool
5,Awesome Definitely a great app for carpentry and other jobs that need one of these
5,Tarun Great utility app
3,Its okay... but it won't let me use the back button!!!
4,Eranda Good
5,Handy! Very handy.
5,just great
4,Bubble Level Really handy and accurate
5,Awesome APP
5,Useful Thankyou :)
5,Awesome Works great
5,Great useful app
4,Great app I haven't had much opportunity to use this, but from what I have it's pretty good.
4,Nice!!!!
5,Excellent!!
5,Excellent
5,great app
5,Useful app
3,Ok Basic but works...
5,Pretty dead on accurate....wow
5,Cool tool Cool tool
5,Great easy to understand level app Very nice graphically appealing level app. Lightweight easy to use and works very well. Thank you.
4,Nice
5,Perfect
5,Perfect!
4,Great!!!!! Love it!!!!!
5,Perfect! Perfect!
5,Fantastic
4,Good
4,Useful
5,Excellent
4,Good stuff
5,Great
5,Great app
5,Great Great app
5,Works. Does what it's supposed. to do
5,Excellent App Very accurate and easy to use application
1,Poor No good
5,ÅöÅöÅöÅö Does good
5,Gr8
5,The precision is great!
5,Brill
5,okhy mksr top app for engineering
4,Good Good
5,Excellent Very useful
5,Works in a pinch... Thanks Don't forget to donate.
5,. Cool App
5,Bubble level Super app.
5,Good Good
4,Good Good
5,Very small Simple and small.
5,Booyah Addicting as funk
5,Excellent app Love it !!!!!!
1,Useless Bloody useless
5,Good Application.
5,It works
5,Works well
5,???? ?????????
5,Awesome app!
5,perfect just what I wanted
5,Thanks
5,Yea thanks
4,Level tool
5,????? ??? ?????? ????? ??? ??????? ???? ????... ??? ????? ???? ????? ??? ??????? ??????.
5,bagus tingkatkan
4,Funktioniert!
5,Ok Ok
5,Ok It does the job.
5,Tin Tin, does what it says on.....
5,Google play hary
1,Sucks! Sucks!
5,Works
5,Thanks
5,Perfrct
5,5 Suppers
5,Very handy and useful
5,Saved the day This works so well. Extremely easy to use. 123
5,Great App! This app does what it is supposed to do, it's handy to have at your fingertips, and it doesn't bother you with obnoxious advertisements. I just hope the developer can figure out a way to put my circular saw into an app!
1,Sucks and useless I had tested with 3 separate levels to check on the levelness of my pictures while I was hanging them. They all showed perfectly level. Than I checked it with this tool, and off level. This app sucks and it's pretty much useless!
1,Battery drain Required update caused my batt to drain. Delete app until I need it then download again then delete the hassle is worth having battery
5,Great! Delicious and nutritious. Thank you.
5,Love it! Its ronseal. No unnecessary permissions, and works great. Lesson to others
5,Just works. I recently moved and used this app to hang everything in my apartment. I love it. Depending on how you hold your phone it will switch to different kinds of levels. Handy and accurate.
5,Great tool
1,Plain (plane, haha) useless on tablet Useless on my tablet. It's always 90 degrees out of alignment with the screen direction. If I lock it to be oriented correctly with the screen, the bubble is at on end or the other. Unlocked it always turns itself vertical but reads 90 degrees with the bubble in the middle. Pure carp.
4,Works good
5,This is the best tool on my phone I love the fact this has both bullseye and vial levels! The fact that it switches between the two automatically is awesome when your hands are busy holding your work. This is the best tool app I've seen and AD free is the icing on the cake.
5,Bubble Level Very precise!
3,Still won't lock Ads now gone. Still doesn't lock
5,Does what it says on the tin! Perfect
5,Great tool. Thank you. Use it almost every day.
5,Awesome Fantastic little app. Does what it says and does it well.
4,Very useful! A necessary and obviously useful tool. Thanks!
5,Great! I use it all the time instead of looking for a big level. Thank you for this handy app.
5,Great Cool
2,Disappointing After a long search among free levelers that do not require any funny permissions I considered this one as one of the best, and installed it to try it out. However, while fiddling with its settings, I tried to go set "Display Type" to "Inclination" and it froze on me. After that, it was freezing every time I tried to go into settings. So, I had to go and clear the application data. Then, I realized that it is not all that accurate either in "Orientation" or in "Accelerometer" sensor mode, and this is not due to my phone, because another app (also called "Bubble") is perfectly accurate. So, I am sorry, but I did not find this app to be any good.
5,Very awesome and useful Love this app. I used to stop my friend complaining that the pool table at the wasn't level.
5,RVing made easy Made setting up my tent trailer a snap. Since they have room be perfectly level to go up straight! Love it
4,Work well, does what it says and easy to use. Overall a solid app.
5,Superb App! This will be really handy for DIY people like me! :)
5,Great in a pinch Completely forgot a level 5 hours away and needed to install in a new apartment, great app as long a you have a nice flat surface.
5,MVS Warren This is a very useful app. I install gates and security systems. I use it a lot. My clients get a kick out of it when I pull my phone out and turn on the level. Very pleased.
5,Awesome Just calibrate before using. You can do that grime the menu in the app. Perfect in every way. Just used to prove my Wife wrong. :-)
5,Great app Used the app to mount my tv on the wall. Saved myself $15!!
5,Works great for me I use this to level my trailer after parking. I also use it to set the elevation angle on satellite antennas.
5,It works. Nothing here that will amaze or inspire, but there doesn't need to be. This app functions correctly, is intuitive, and stable.
5,Exactly what I needed Great app. It does exactly what it says.
5,Free. ACCURATE WOW! Thank you for not having ads
5,What's not to like Nice work. Nice easy to use app. Thanks
4,Works It works but only as good as the calibration and how well you can balance your phone on an object.
4,Works good The only thing it needs is a way to lock the pitch reading when measuring roof pitch over your head and you can't read the screen because of the glare
5,Great Tool I work in architecture and find myself using this cool app on construction sites checking various materials installed around buildings. Took the place of me carrying a pocket size level around with me since I always carry my phone. Droid 4
3,Xperia U just crap Possibly working fine on other devices
4,Bubble leveler Simple and nice! Works great also.
5,Superb Handy and useful application.
4,Useful Not always convinced on total accuracy,may just be my phone config tho.
4,Great I have this app on my tablet and its very useful. I like the way the level changes to a circle when i lay the tablet flat so i can check level on two planes at once.
5,Just what I need Simple, elegant and fun to use
5,Great app! I have a set of front load washer and dryer. I purchased the pedestal drawers for them and used the app to level them, it worked flawlessly! Thank you!
5,Superb I actually used this to level a machine when the standard level had leaked away. God ! It worked !
5,Works ! Works good on the LG.Even used it on my gf and it said she was not on the same level.Works awsome get it !
5,Did exactly what I needed! Worked perfectly. Worth it.
5,Simple and effective This is the only leveling tool you need. Have been using this on every device I've had. Extremely stable and just does what it's meant to.
4,Can be tricky to calibrate but once done it works great. Small file size ... Can be tricky to calibrate but once done it works great. Small file size too puts it above any similar app
5,Great ap to have. You never know when you need a level.
5,Recommended Does exactly what you want it to. Simple spirit level
5,Excellent Got us out of trouble when without a "real" level. Worked a treat. Recommended. And free too!
