4,Bubble Fantastic! !
5,Thanks!
5,Bubble level
4,Not for tablets? On my Xoom it shows the portrate leveler when the tablet is in landscape mode and vice versa. When it is flat the leveler is off by 90 degrees anticlockwise
5,Served its purpose Works well.
4,Level application
5,awsome awesome
5,Works Works
5,Does the job Worked as expected.
3,Kinda Works
4,Jack of all trades It's free, It's ad free and it works. What more do you want?
5,R2 Works. Won't replace a real tool but sometimes all u need is this
4,?timo. Simples como deve ser e funciona muito bem! S? tenho d?vidas sobre a precis?o da informa??o dele.
5,Very cool
1,Even calibrated.with a level tool its totally off and the bubble is moving slow ... Even calibrated.with a level tool its totally off and the bubble is moving slow and unreal. For real measurments FORGET IT!
3,Its ok it is easy to use and check the balance. Wish something of ... Its ok it is easy to use and check the balance. Wish something of this sort comes for humans also
4,Great. Just needs temporary calibration, I.e., to test parallel but not level ... Great. Just needs temporary calibration, I.e., to test parallel but not level surfaces.
5,I like it Works great for leveling my travel trailer since it doesn't have to be perfect, just close enough. The audible tone is great since I can lay the phone on a counter top, crank the volume then go outside and mess with the jacks.
1,I dont like anyone accessing my system tools, so I wont update this app.
2,This app need a perfect surface for calibration when others don't. Others do two ... This app need a perfect surface for calibration when others don't. Others do two cal per axis, with phone rotated 180Åã on 2nd cal. More star if fixed.
1,Bubble does not move the right way. Bubbles rise! Learn some physics people!
5,Functional, elegant, and the second thing I show people on my phone. (First is ... Functional, elegant, and the second thing I show people on my phone. (First is Marine Compass).
2,Worked great for a while. Then the axes got switched. Have to calibrate every ... Worked great for a while. Then the axes got switched. Have to calibrate every use now.
5,I've used this for hanging shelves, curtain rods and to level my washing machine. ... I've used this for hanging shelves, curtain rods and to level my washing machine. Works great as far as I can tell
5,For me, its the BEST SPIRIT LEVEL app out there!
4,Nice app but assumes edges of phone are flat Only one edge of my Verizon Casio Commando is flat enough to use as a reference so frequently the numbers are sideways or upside down. The Commando also has a protruding area on one corner of back so it needs to hang over the edge of a surface to lay flat. Calibration needs better explanation.
5,Hayeso I run a small construction business and this app is awesome, very accurate and have even used it to set up roof pitches prior to constructing them ,thanks guys great app
5,Works Works
5,Simple and effective. Very responsive to phone orientation. A++
5,Best free bubble level app in my opinion. No ads, can be moved to ... Best free bubble level app in my opinion. No ads, can be moved to SD card, clean and simple.
4,accurate but cant save on my xperia x10 how can i save the calibration on my xperia x10?
5,Level
5,One of the best apps out. Figured up a big roof job with multiple ... One of the best apps out. Figured up a big roof job with multiple pitches with ease using this to get accurate pitch angles!
5,Great application. Would be even better if the colors of the fluid and bubble ... Great application. Would be even better if the colors of the fluid and bubble would be configurable.
5,great app iv never used it propoly yet but its handy
2,Doesn't save calibration on accelerometer, which renders it useless. :-( #fixit
5,Physics work fine on mine... Great app simple straight forward and spot on according to the one I went to the hardware store for.
2,No way to calibrate it; phone edges are not square due to buttons and ... No way to calibrate it; phone edges are not square due to buttons and the back is not square due to the battery compartment. Wish I'd realized sooner.
5,Worked well for leveling my new shelves. :) nice to see an honest app ... Worked well for leveling my new shelves. :) nice to see an honest app that doesn't ask for unnecessary permissions.
5,Bubble level It is totally awesome. Now I can make sure that I do a job right the first time.
2,Needs recalibration every use, no orientation on startup gets it right (HTC ... Needs recalibration every use, no orientation on startup gets it right (HTC Thunderbolt)
5,!!! The D/R makes this the best app of its kind.
4,@ Robert installed and works perfectly on my rooted DX.
5,Worked great! Saved the day today.
5,Does the job. Very nice interface. Only pb with motodefy is that the sides ... Does the job. Very nice interface. Only pb with motodefy is that the sides and the back of the phone aren't flat.
4,Really simple and effective. Calibrates easily.
5,Awesome Works like a charm! Thank you!
4,It's not as sensitive as a real level, but still a great app and ... It's not as sensitive as a real level, but still a great app and works very well!
3,App works great but will not update or uninstall on my HTC Incredible.
5,Wow I check my scaffold with this 1000 percent accurate. excellent
1,Worked great untill updated to 1.7.4. Now everything is upside down and unusable. ... Worked great untill updated to 1.7.4. Now everything is upside down and unusable. Droid X.
5,Great app. Must have. Samsung Galaxy S.
5,Silverware drawer fixed, wife happy. Thx!
5,All my pictures are level, wifes happy, thanks
5,Works as advertised. I still haven't used it much, but I keep it around... ... Works as advertised. I still haven't used it much, but I keep it around... just in case.
1,Won't work anymore.
4,Bubble level Use this app all the time! It's a neat little tool to have!
5,Top App Best one so far.
4,One of those silly apps you grab as a lark but I've found it ... One of those silly apps you grab as a lark but I've found it really useful. It's simple but seems to do the job on my galaxy s phone.
1,Way too slow response try spirit level instead. This one really sucks!
5,Great app! Simple and easy to use. Very helpful.
5,Simple, reliable, accurate.
0,Why are there so many updates for this app?
3,Cute but I wouldn't build a house with it.
0,Tnjujuwuuernjneu:-$:'(un
5,It works and it is handy. Can't get better than that!
5,I used it to put in a fence. Worked perfectly.
4,Solid. Does exactly what it says. For a handy level with added gadgets it ... Solid. Does exactly what it says. For a handy level with added gadgets it is great. People need to remember that its a phone :)
5,Samsung galaxy s 4g Works great in a pinch
4,Works good on the Captivate. Helpful app. Calibration is a bit off.
5,Love this cool little app, works great. Now know we've not got any level ... Love this cool little app, works great. Now know we've not got any level surfaces at home....
2,A bit boring and not actually that useful.
5,v1.8.0 Great. Clean and simply works.
1,I lined it up with a real level, its way off
4,Alex Very good work ok.
5,Works great, Hung a shelf, perfectly level all around. HTC Aria
5,I install appliances......perfect for what I do, and I impress the home owners. ... I install appliances......perfect for what I do, and I impress the home owners. "yep it level"
5,Fantastic. Once calibrated with known level surface, works flawlessly
5,Great! Now I can measure crap for free! Lol
1,Seems to be off on my phone. Even when calibrated. EVO.
5,Very good & usefull app. Thanks alot
5,Used it to hang my big screen TV on the wall, no probs...atrix
5,Awesome Great app. Works pretty well.
5,Works. Easy to use. Looks good. Nice job.
5,Very nice. I used it to install shelves. Droid Incredible
5,Great app for putting up shelves and pictures
0,Worked 1st time needed it & downloaded!
1,I could not get it to work on my HTC hero.
5,The best. Works great on a motorola atrix and no advertising what else can ... The best. Works great on a motorola atrix and no advertising what else can you ask for
4,Excellent on HTC wildfire.
1,No install Droid X Program failed to install on Droid X
5,Great app, works better than a real one
1,Won't calibrate on Atrix.
5,As good as it gets. Simple and easy to use.
5,Works great with Motorola ATRIX.
3,Works as described, not fancy, but gets the job done.
5,A simple, elegant app that does exactly what it says.
5,Good. Works on droid x.
1,Crap Didn't work properly
1,Does not keep calibration. Uninstalled.
5,Nice, works great on Samsung Galaxy Indulge
5,Just a really well done app.
5,Much more accurate and sensitive than other levels
4,Good conversation piece. Could be more accurate.
5,Love it, easy and accurate
5,Works great for a free app
5,Wonderful! This is going to be a great time and labor saver!
1,Looses callibration too frequently
5,Great app droid x
5,Exellent app good for calibrating other levels
5,A Very handy
1,EXTREMELY INACCURATE! Calibrated SEVERAL times trying to get the settings ... EXTREMELY INACCURATE! Calibrated SEVERAL times trying to get the settings correct. Uninstall!
5,AWESOME !
1,Axes are again mixed up. You'd think a software developer would cover all the ... Axes are again mixed up. You'd think a software developer would cover all the bases but nowadays the developers are plain lazy.
5,Worked great today
5,Drunk Helps me make sure the beer-pong table is level.
5,Very handy.
5,Clint Perfect for a level
5,Very useful
5,Works good on droidx
5,Great when rushed or just to proove a point
5,Convenient, easy to use, accurate, and worked flawlessly. HTC Droid Incredible
5,Worked great in a pinch
5,I love this.
4,Simple useful app to have
5,Works great.
5,Great usefull app......thanks...
4,Very useful! Nice app
5,Great Works great
5,Very helpful!
5,Does what you'd expect it to do :)
5,love this app
4,Bubbly. Works.
4,acurate, but pointless on anything but a square phone!
1,Inaccurate
2,Not accurate
3,Okay App No matter how much I calibrated it, it's still off.
4,Great app
5,Great find Just works
5,Fantastic
1,Not level on my incredible
5,Accurate How clever
5,Tell ya truth it's a must have....
4,Excellent
5,Very handy for a quick check
5,Pretty good.
2,Not accurate at all.
4,Mtn. Man Droid X ... works as advertised. Thanks!
5,Loaded on a whim. I actually use it!
5,Nice work..
3,Its ok, however numbers never stop. Laid phone on a flat surface number kept ... Its ok, however numbers never stop. Laid phone on a flat surface number kept changing. Not good for accurate readings
5,I'm a contractor and used this app for the first time when I was ... I'm a contractor and used this app for the first time when I was pressed for time with no level. It performed remarkably!
4,Great app.However if i wanted to calibrate it I would need 2 know somethin ... Great app.However if i wanted to calibrate it I would need 2 know somethin was already level. In which I would need a level. So why would I need it
1,Does not work! It suks.
5,It works very well thanks
5,Helped while working on a construction job I did recently.
3,Latest version fails install on OTA-updated Evo with 'unknown reason -18.' Fix for ... Latest version fails install on OTA-updated Evo with 'unknown reason -18.' Fix for 5 stars.
5,Cool
5,Works well looks good and its free what more could you want
5,What a cool practical app. Definitely one for the boys.
5,Not just a bubble level. Also has the degree of tilt. Awesome. Droid X
5,Very acurete!
5,yuk yuk
4,Bubble level
5,Great App, it is kept up to date, love the ability to calibrate it ... Great App, it is kept up to date, love the ability to calibrate it too! Very sophistiated for a bubble level, easy to use.
3,Alright, other bubble app seems more realistic and better graphics though.
5,Helped
5,Does what it days on the tin
4,I use it almost every day & it works just great, not had any ... I use it almost every day & it works just great, not had any problems so far.
2,Works on Droid X. Fairly accurate, but not "True".
5,This app came in real handy when I couldn't find my real level while ... This app came in real handy when I couldn't find my real level while hanging my television. Got that puppy perfectly level!
4,cool app. used it on simple installations around the house. (shelves, cupboard ... cool app. used it on simple installations around the house. (shelves, cupboard doors, mirrors, etc.) wouldn't use it for major projects though
4,Cool app but doesn't work on droid x due to the camera sticking out ... Cool app but doesn't work on droid x due to the camera sticking out of the back.
5,Very simple, nifty little gadget.
5,Simple. Stable. Solid. Ad free. Deleted rival "level" apps and keeping this. Great ... Simple. Stable. Solid. Ad free. Deleted rival "level" apps and keeping this. Great on unrooted DesireHD.
5,Works great! Samsung Galaxy S.
3,Better than nothing, but reads +/- 3 degrees, depending on the Orientation of the ... Better than nothing, but reads +/- 3 degrees, depending on the Orientation of the phone. Driod X.
5,Awesome....Mitch isn't very bright is he? Droid x
4,Seems to have a small issue at about 42 degrees with keeping which gui ... Seems to have a small issue at about 42 degrees with keeping which gui to use but otherwise very useful.
1,Does not actually work
5,Works great what else can you ask for?
5,Very cool. Works fine on Samsung Galaxy Tab.
1,Tries to update constantly, fails every time, even with SD unmounted. Uninstall. ... Tries to update constantly, fails every time, even with SD unmounted. Uninstall. Droid 2.
5,This app scored a win for me over a crooked picture. So 5 stars ... This app scored a win for me over a crooked picture. So 5 stars it is.
3,The level is great. The daily updates are annoying!
5,Impresses the hell outta the maintenance guys at work.
3,Simple bubble level. Use a real level to get that shelf straight
5,Great app. Droid inc.
5,Very nice thanks perfect for galaxy s
2,Update won't install on my Droid2, after maybe 10 tries
5,Right down to the exact number. Droid x
1,Way off on galaxy s
5,Works great. Droid x
5,Great little app :)
1,Not showing up in my apps after install and restart. Galaxy S w/ Froyo
1,Doesnt work correcty on droid 2 calibration needs work.
5,Very usefull for my work
2,Works, but after calibration, it goes to the wrong screen orientations. Captivate
3,Dose what it says handy for odd jobs
1,Extremely inaccurate... bubble is so much better
0,You get what you pay for lol
1,Needs 45 degrees
5,Good stuf
5,Pure and simply awesome
4,Great app, works perfectly
5,Very cool. Works ok.
5,Acurate :P
4,Does what it should, simple.
5,Perfect. Droid incredible
5,Nice little app
4,Handy! Very good app
4,Useful
0,Great!
5,Perfect thankyou :-)
5,Simply does what it says
3,Enough with the constant updates for other languages. Becomes a pain that it's ... Enough with the constant updates for other languages. Becomes a pain that it's always looking to be updated
1,Crap
4,Works
4,Ideal little app great for leveling up my caravan.
3,Does what it says
4,Works really well, mostly. The bubble behaves strangely in landscape when Eco mode ... Works really well, mostly. The bubble behaves strangely in landscape when Eco mode is enabled.
5,Simple app, does exactly what it's suppossed to. Five stars.
5,Thanks Antoine, very useful! Works well. Samsung Galaxy S
3,It's off
5,Brilliant little app
1,Update for driod x made this junk freeze freeze froze uninstalling
4,Very useful for checking the level of something on a wall, but it's useless ... Very useful for checking the level of something on a wall, but it's useless when the phone is placed on its back.(Droid X-others don't have this flaw)
5,Works well
4,Works Droid inc
5,Does exalt what it says.
5,Best free bubble level app I have found. Highly recommend. Well done. Samsung ... Best free bubble level app I have found. Highly recommend. Well done. Samsung Captivate.
5,Works great on my Sanyo ZIO, does what it promises to!
5,This thing is awesome! Don't have to run to the garage any more to ... This thing is awesome! Don't have to run to the garage any more to get the real thing. The digital balance at the bottom is what makes it the best!
5,Excellent app & tool. In addition to normal leveling jobs, I use it to ... Excellent app & tool. In addition to normal leveling jobs, I use it to level my motorhome!
5,Good app that wont go wrong :-)
5,Works very well on my x10a still running on 1.6 o/s because AT&T wont ... Works very well on my x10a still running on 1.6 o/s because AT&T wont release system updates. Choose wisely.
1,Update crashes on Driod X. Installation Error-18. Unknown.
5,Cool little app! Handy & as close as your cell when you need it!
5,Works great for doing little jobs when your torped level is just out of ... Works great for doing little jobs when your torped level is just out of reach.super accurate
5,All others flip between horizontal and vertical glass after 45 degrees. This one ... All others flip between horizontal and vertical glass after 45 degrees. This one allows lockIng to one mode. Essential for carpentry. HTC Desire.
1,Checked against real level. Not level. Would not calibrate correctly. HTC Droid ... Checked against real level. Not level. Would not calibrate correctly. HTC Droid Verizon
1,Very inaccurate even after calibration. . . Uninstalled. Droidx
4,Good app, but yet to have a use 4 it.
4,Simple, but does what it says on the tin - HTC desire HD.
5,It works! The recalibration feature is awesome.
5,Love it. Always handed and v accurate
5,Cool app, I find it to be fairly accurate. would you please post a ... Cool app, I find it to be fairly accurate. would you please post a change log with updates though.
5,This app is awesome!!!. Comes in handy.
4,Works great, but constant language updates get annoying.
1,This is wildly inaccurate. Don't waste your time.
1,For me...this app is useless
1,This app is freaking joke, you have to calibrate it yourself. Galaxy s
5,Love it, works great in a pinch! Samsung Mesmerize.
5,If you want/need a bubble level app, this is the one for you.
4,Wouldn't bet my life on it but it does what it should
0,It is a great app it is very acurate
3,Orientation not supported. Nook Color.
5,Effective app and neat design. Thanks
5,I love this app
5,Love it, and use it all of the time
5,best bubble app on the market smooth and easy to use
5,Accurate and useful.
5,Easier then a level.
3,HMM WORKS GOOD le
5,Does what it says on the tin - a handy little app.
5,Very smooth, seems accurate too, well worth a download.
5,Helped me out of a sticky IKEA moment. Top app!
4,What you see is what you get
1,Horizontal was miles off
5,Thank you for your honorable use of the word free. The prevalence of adware ... Thank you for your honorable use of the word free. The prevalence of adware is disheartening. Spiffy tool
4,Seems great to me
5,Awesome
4,Very useful.
5,Bravo!!!!
5,Excellent
5,Accurate
4,works great, very handy
0,Its not accurate on the droid x
3,Pretty decent
5,, Rx CNN
5,Works like its supposed to.
5,Useful
5,very nice works great
5,Does the job
5,Works as described
4,Works like it should
5,Its ok
4,I like this a bit better than the rest. It doesnt hang and the ... I like this a bit better than the rest. It doesnt hang and the display is very clear and clean. A few too many permissions?
5,Cool ap. Works better than a real bubble level.
3,Why do u need to update a level everyday? Other than that its good. ... Why do u need to update a level everyday? Other than that its good. Droid x
5,A great way to not get bored while standing in line!
3,Cool but kinda useless. Whos really gonna use their phone for a level.
5,This had been very useful on jobsites because I can do surprise quality control ... This had been very useful on jobsites because I can do surprise quality control checks without carrying a larger level everywhere!
4,It appeared to work fine, but my battery usage indicated the app was drawing ... It appeared to work fine, but my battery usage indicated the app was drawing power even when not in use. Even after a forced stop, it still drew power
4,Nice Ap. I like to use it with my Bluetooth. I can hear when ... Nice Ap. I like to use it with my Bluetooth. I can hear when it hits...without looking. Thx. Evo
5,Crazy how accurate it is.and you get three levels with this app.
5,Great app and its always on your side when you need it now I ... Great app and its always on your side when you need it now I need a tape messure lol
5,I don't ever pay for apps let alone donate but I had to with ... I don't ever pay for apps let alone donate but I had to with this app. Made a simple app into something a little better.
5,I used it to hang up pictures and shelves and it looks great!
5,Nice Samsung Fascinate - Android 2.1 - Works good on my phone. Pretty accurate compared to my level. Does need a 45 degree.
3,Does the job as a basic level, with readout in degrees. But, unlike"bubble", it ... Does the job as a basic level, with readout in degrees. But, unlike"bubble", it has only one calibration, for flat, not for edges.
5,Great!! Really came in handy today hanging pics at my moms new home. Very ... Great!! Really came in handy today hanging pics at my moms new home. Very cool!
4,Will not update on my droid. Version I have works great.
5,Perfect for those OCD types who like to have their pictures level all the ... Perfect for those OCD types who like to have their pictures level all the time. Calibrate it with a real level and you're set!
5,Came in useful when had to put up some curtains!
1,Not worth it, bubble is much better. This one freezes and will not calibrate.
5,A real must have! Works great.
5,My girlfriend thought it was a game and didn't understand why she wasnt winning. ... My girlfriend thought it was a game and didn't understand why she wasnt winning. I'll never get rid of this app lol
4,Haven't had a need for it yet but I have it installed just in ... Haven't had a need for it yet but I have it installed just in case. Seems to work well.
3,Haven't really found a use for it on a phone but its ok.
5,Works better than expected
5,Pretty happy with my level shelves thanks bubble!
5,Worked great for leveling the stove
4,This app comes in handy
5,Built my house with this! Just kidding... have not checked with a level yet ... Built my house with this! Just kidding... have not checked with a level yet but seems good!
5,Works as advertised on Evo, very handy
5,Great tool for finding out the angle degree of an object
2,Excellent interface, but is not accurate for any real use. After calibration, when ... Excellent interface, but is not accurate for any real use. After calibration, when turned back on again, the same surface showed non level. Uninstall.
5,This thing is honestly very good. Highly recommended.
5,Great app. Does everything very well.
5,Everything is now perfectly arranged. From the foozball table and paintings to my ... Everything is now perfectly arranged. From the foozball table and paintings to my books and tables! Relief.
3,Not so accurate, but It's ok
4,Back to 4 stars as dev has included a changelog. Simple, attractive and uncluttered ... Back to 4 stars as dev has included a changelog. Simple, attractive and uncluttered spirit level.
4,Getting -18 installation error on 2.2.1. Need to unmount sd card to install.
5,Love it. Simple and easy! Sgs 2.2
5,Works perfectly!
5,Great great!
5,This is a must have tool for everyone. Works good for me.
5,It's awesome
5,Sweet droidX
5,Great app!
5,Nice gadget, sometimes a useful tool.
5,Very handy
5,Great app.
4,Work's great.
5,Very handy app
4,Worked great!!
5,Great app.
1,Updates fail every time droid x, please fix it
5,Great app really useful
5,Guba! (On Croatian that means Cool!)
5,Fail to upgrade on HTC magic
5,Useful
1,Install app2SD not working on nexus 1. Release description install on SD is wrong.
5,Finally I can level the stove!
5,no ads!
5,Very useful. Great app when needed. No flaws that I can see. Evo4g
4,Perfect
5,Does wat it says on the tin
5,Awesome app
5,Does exactly what it's supposed to. I love it.
5,Great to have when you need it.works perfectly. Impressive accuracy. HTC ... Great to have when you need it.works perfectly. Impressive accuracy. HTC incredible
4,Simple and good
3,Fix the updates...
4,Works great on my Galaxy S
4,Very accurate it do what it designed to do
5,Awesome
5,Good if you don't have one handy. SPRINT EVO
5,Don't know what these fools are talking about, works perfectly on my Droid ... Don't know what these fools are talking about, works perfectly on my Droid Incredible
4,This app is exactly what it says, and I think it is very useful ... This app is exactly what it says, and I think it is very useful for certain projects.
5,Good job
1,Completely inaccurate. Does not work within any reasonable margin of error. Evo.
4,Great app, but can u let everyone know what gets updated during all of ... Great app, but can u let everyone know what gets updated during all of the updates?
1,Terrible, used it and it was off and it screws up when you do ... Terrible, used it and it was off and it screws up when you do cumstom calibration, there is another bubble that works better, I have a droidx
1,No explanations about what you are updating... my GPS app does same task as ... No explanations about what you are updating... my GPS app does same task as you... explain future updates, or you are gone...
